Sheet: Накладная
M1: Унифицированная форма № ТОРГ-12 Утверждена постановлением
M2: Госкомстата России от 25.12.98 №132 | R2: Код
P3: Форма по ОКУД | R3: 330212
A4: ОРГАНИЗАЦИЯ | P4: по ОКПО
A5: грузоотправитель, адрес ,номер телефона, банковские реквизиты | P5: Вид деятельности по ОКДП
A6: грузоотправитель, адрес ,номер телефона, банковские реквизиты
A7: структурное подразделение
A8: ГРУЗОПОЛУЧАТЕЛЬ | P8: по ОКПО
A10: ПОСТАВЩИК | P10: по ОКПО
A12: ПЛАТЕЛЬЩИК | P12: по ОКПО
A14: ОСНОВАНИЕ | Q14: Номер
Q15: Дата
N16: Транспортная накладная | Q16: Номер | R16: -
Q17: Дата
G18: договор, заказ-наряд | O18: Вид операции
C19: Товарная накладная | G19: Номер документа | J19: Дата составления
A22: № по п/п | B22: Товар | F22: Код | G22: Единица измерения | I22: Вид упак. | J22: Количество | L22: Масса брутто | M22: Количе-ство (масса, нетто) | N22: Цена, руб.коп | O22: Сумма без учета НДС,руб.коп | P22: НДС | R22: Сумма с учетом НДС, руб
B23: наименование, характеристика,сорт,артикул товара | G23: Наимено-вание | H23: Код по ОКЕИ | J23: в одном месте | K23: мест, штук | P23: Ставка % | Q23: Сумма, руб.коп
A24: 1 | B24: 2 | F24: 3 | G24: 4 | H24: 5 | I24: 6 | J24: 7 | K24: 8 | L24: 9 | M24: 10 | N24: 11 | O24: 12 | P24: 13 | Q24: 14 | R24: 15
G25: Всего по накладной | M25: =SUM(R[-{count(set[@name='ShipmentItems']/ShipmentItem)}]C:R[-1]C) -> 1400 | N25: х | O25: =SUM(R[-{count(set[@name='ShipmentItems']/ShipmentItem)}]C:R[-1]C) -> 1960 | P25: х | Q25: =SUM(R[-{count(set[@name='ShipmentItems']/ShipmentItem)}]C:R[-1]C) -> 352.8 | R25: =SUM(R[-{count(set[@name='ShipmentItems']/ShipmentItem)}]C:R[-1]C) -> 2312.8000000000002
A27: Товарная накладная имеет приложение на _________________ листах и содержит порядковых номеров записей
J28: Масса груза (нетто) | R28: т
A29: Всего мест ________________________ | J29: Масса груза (брутто) | R29: т
A31: Приложение (паспорта, сертификаты и т.п.) на | F31: листах | L31: По доверности №
A32: Всего отпущено на сумму: | D32: =R[-7]C[14] -> 100 | L32: выданной
L33: Груз принял
A34: Отпуск разрешил: | C34: Директор | F34: Холодников Ю.В. | L34: Груз получил грузополучатель_______________________________
A35: Главный (старший) бухгалтер | F35: Раупова Т.В. | L35: "____"______________________________________ 2017 г.
A36: Отпуск груза произвел: | C36: Нач. цеха | F36: Холодников М.Ю. "_____"_________2017г.
B38: М.П. | N38: М.П.