Sheet: Лист1
A1: Учет прямых затрат на наряд 25.11.2016 - 25.12.2016
A3: Чертеж | B3: Группа | C3: Наименование | D3: Вып-но дета-лей, шт. | E3: Сырье и мат-лы, руб. | F3: Основная зарплата, руб. | G3: Транс-портные, руб. | H3: Э/эн. для форм-х, руб. | I3: Э/эн. прочая, руб. | J3: Итого, руб.
A5: Наряд № от 05.12.2016
A6: 370.210-1 | B6: 8СЯ | C6: Прокладка | D6: 250 | E6: 252.5 | F6: 347 | G6: 17.5 | H6: 1912.5 | I6: 42.5 | J6: =SUM(RC[-5]:RC[-1]) -> 2572
A7: Итого по наряду | D7: =SUM(R[-1]C:R[-1]C) -> 250 | E7: =SUM(R[-1]C:R[-1]C) -> 252.5 | F7: =SUM(R[-1]C:R[-1]C) -> 347 | G7: =SUM(R[-1]C:R[-1]C) -> 17.5 | H7: =SUM(R[-1]C:R[-1]C) -> 1912.5 | I7: =SUM(R[-1]C:R[-1]C) -> 42.5 | J7: =SUM(RC[-5]:RC[-1]) -> 2572
A9: Наряд № от 07.12.2016
A10: 370.210-1 | B10: 8СЯ | C10: Прокладка | D10: 250 | E10: 252.5 | F10: 347 | G10: 17.5 | H10: 1912.5 | I10: 42.5 | J10: =SUM(RC[-5]:RC[-1]) -> 2572
A11: Итого по наряду | D11: =SUM(R[-1]C:R[-1]C) -> 250 | E11: =SUM(R[-1]C:R[-1]C) -> 252.5 | F11: =SUM(R[-1]C:R[-1]C) -> 347 | G11: =SUM(R[-1]C:R[-1]C) -> 17.5 | H11: =SUM(R[-1]C:R[-1]C) -> 1912.5 | I11: =SUM(R[-1]C:R[-1]C) -> 42.5 | J11: =SUM(RC[-5]:RC[-1]) -> 2572
A13: Наряд № от 08.12.2016
A14: 372.000 | B14: 5-5АИ. | C14: Шайба обрезиненная | D14: 10 | E14: 890.8 | F14: 763.4 | G14: 62.4 | H14: 500 | I14: 99.2 | J14: =SUM(RC[-5]:RC[-1]) -> 2315.7999999999997
A15: 10-6 ГОСТ 19421-74 | B15: - | C15: Втулка предохранительная | D15: 140 | E15: 70 | F15: 97.16 | G15: 5.6 | H15: 397.6 | I15: 11.2 | J15: =SUM(RC[-5]:RC[-1]) -> 581.56000000000006
A16: 6*10*16 ГОСТ 19421-74 | B16: - | C16: Втулка предохранительная | D16: 140 | E16: 71.400000000000006 | F16: 97.16 | G16: 5.6 | H16: 397.6 | I16: 11.2 | J16: =SUM(RC[-5]:RC[-1]) -> 582.96
A17: 18*22 | B17: - | C17: Палец | D17: 70 | E17: 93.1 | F17: 212.541 | G17: 6.3 | H17: 247.8 | I17: 24.5 | J17: =SUM(RC[-5]:RC[-1]) -> 584.24099999999999
A18: L40 | B18: - | C18: Трубка дренажная | D18: 70 | E18: 51.1 | F18: 145.74 | G18: 3.5 | H18: 228.2 | I18: 16.100000000000001 | J18: =SUM(RC[-5]:RC[-1]) -> 444.64
A19: 760.023 | B19: 8СЯ | C19: Пластина | D19: 11 | E19: 1105.5 | F19: 152.68 | G19: 77.44 | H19: 223.3 | I19: 39.71 | J19: =SUM(RC[-5]:RC[-1]) -> 1598.63
A20: 760.024 | B20: 8СЯ | C20: Пластина | D20: 5 | E20: 565 | F20: 69.400000000000006 | G20: 39.549999999999997 | H20: 101.5 | I20: 19.350000000000001 | J20: =SUM(RC[-5]:RC[-1]) -> 794.8
A21: 300 | B21: Ду | C21: Компенсатор | D21: 9 | E21: 8178.75 | F21: 124.92 | G21: 572.49 | H21: 704.7 | I21: 188.1 | J21: =SUM(RC[-5]:RC[-1]) -> 9768.9600000000009
A22: 10-6 ГОСТ 19421-74 | B22: - | C22: Втулка предохранительная | D22: 140 | E22: 70 | F22: 97.16 | G22: 5.6 | H22: 397.6 | I22: 11.2 | J22: =SUM(RC[-5]:RC[-1]) -> 581.56000000000006
A23: 6*10*16 ГОСТ 19421-74 | B23: - | C23: Втулка предохранительная | D23: 140 | E23: 71.400000000000006 | F23: 97.16 | G23: 5.6 | H23: 397.6 | I23: 11.2 | J23: =SUM(RC[-5]:RC[-1]) -> 582.96
A24: 68*50*9 | B24: - | C24: Прокладка отстойника | D24: 140 | E24: 275.8 | F24: 485.8 | G24: 19.600000000000001 | H24: 2083.1999999999998 | I24: 57.4 | J24: =SUM(RC[-5]:RC[-1]) -> 2921.7999999999997
A25: 370.210-1 | B25: 8СЯ | C25: Прокладка | D25: 250 | E25: 252.5 | F25: 347 | G25: 17.5 | H25: 1912.5 | I25: 42.5 | J25: =SUM(RC[-5]:RC[-1]) -> 2572
A26: Итого по наряду | D26: =SUM(R[-12]C:R[-1]C) -> 1125 | E26: =SUM(R[-12]C:R[-1]C) -> 11695.349999999999 | F26: =SUM(R[-12]C:R[-1]C) -> 2690.1210000000005 | G26: =SUM(R[-12]C:R[-1]C) -> 821.18000000000006 | H26: =SUM(R[-12]C:R[-1]C) -> 7591.5999999999995 | I26: =SUM(R[-12]C:R[-1]C) -> 531.66 | J26: =SUM(RC[-5]:RC[-1]) -> 23329.911
A28: Наряд № от 09.12.2016
A29: 370.210-1 | B29: 8СЯ | C29: Прокладка | D29: 340 | E29: 343.4 | F29: 471.92 | G29: 23.8 | H29: 2601 | I29: 57.8 | J29: =SUM(RC[-5]:RC[-1]) -> 3497.92
A30: 233 | B30: - | C30: Прокладка | D30: 216 | E30: 2516.4 | F30: 1499.04 | G30: 177.12 | H30: 1134 | I30: 153.36000000000001 | J30: =SUM(RC[-5]:RC[-1]) -> 5479.92
A31: Итого по наряду | D31: =SUM(R[-2]C:R[-1]C) -> 556 | E31: =SUM(R[-2]C:R[-1]C) -> 2859.8 | F31: =SUM(R[-2]C:R[-1]C) -> 1970.96 | G31: =SUM(R[-2]C:R[-1]C) -> 200.92000000000002 | H31: =SUM(R[-2]C:R[-1]C) -> 3735 | I31: =SUM(R[-2]C:R[-1]C) -> 211.16000000000003 | J31: =SUM(RC[-5]:RC[-1]) -> 8977.84
A33: Наряд № от 10.12.2016
A34: 370.210-1 | B34: 8СЯ | C34: Прокладка | D34: 0 | E34: 0 | F34: 0 | G34: 0 | H34: 0 | I34: 0 | J34: =SUM(RC[-5]:RC[-1]) -> 0
A35: 233 | B35: - | C35: Прокладка | D35: 0 | E35: 0 | F35: 0 | G35: 0 | H35: 0 | I35: 0 | J35: =SUM(RC[-5]:RC[-1]) -> 0
A36: Итого по наряду | D36: =SUM(R[-2]C:R[-1]C) -> 0 | E36: =SUM(R[-2]C:R[-1]C) -> 0 | F36: =SUM(R[-2]C:R[-1]C) -> 0 | G36: =SUM(R[-2]C:R[-1]C) -> 0 | H36: =SUM(R[-2]C:R[-1]C) -> 0 | I36: =SUM(R[-2]C:R[-1]C) -> 0 | J36: =SUM(RC[-5]:RC[-1]) -> 0
A38: Наряд № от 19.12.2016
A39: 372.000 | B39: 5-5АИ. | C39: Шайба обрезиненная | D39: 10 | E39: 890.8 | F39: 763.4 | G39: 62.4 | H39: 500 | I39: 99.2 | J39: =SUM(RC[-5]:RC[-1]) -> 2315.7999999999997
A40: 10-6 ГОСТ 19421-74 | B40: - | C40: Втулка предохранительная | D40: 140 | E40: 70 | F40: 97.16 | G40: 5.6 | H40: 397.6 | I40: 11.2 | J40: =SUM(RC[-5]:RC[-1]) -> 581.56000000000006
A41: 6*10*16 ГОСТ 19421-74 | B41: - | C41: Втулка предохранительная | D41: 140 | E41: 71.400000000000006 | F41: 97.16 | G41: 5.6 | H41: 397.6 | I41: 11.2 | J41: =SUM(RC[-5]:RC[-1]) -> 582.96
A42: 18*22 | B42: - | C42: Палец | D42: 140 | E42: 186.2 | F42: 425.08199999999999 | G42: 12.6 | H42: 495.6 | I42: 49 | J42: =SUM(RC[-5]:RC[-1]) -> 1168.482
A43: L40 | B43: - | C43: Трубка дренажная | D43: 140 | E43: 102.2 | F43: 291.48 | G43: 7 | H43: 456.4 | I43: 32.200000000000003 | J43: =SUM(RC[-5]:RC[-1]) -> 889.28
A44: 68*50*9 | B44: - | C44: Прокладка отстойника | D44: 195 | E44: 384.15 | F44: 676.65 | G44: 27.3 | H44: 2901.6 | I44: 79.95 | J44: =SUM(RC[-5]:RC[-1]) -> 4069.6499999999996
A45: 20*5*13 | B45: - | C45: Шайба с бортом | D45: 315 | E45: 144.9 | F45: 485.79300000000001 | G45: 9.4499999999999993 | H45: 0 | I45: 53.55 | J45: =SUM(RC[-5]:RC[-1]) -> 693.69299999999998
A46: 307.026 | B46: 8БП | C46: Колпачок | D46: 210 | E46: 0 | F46: 485.79300000000001 | G46: 0 | H46: 514.5 | I46: 50.4 | J46: =SUM(RC[-5]:RC[-1]) -> 1050.693
A47: 207*8*8 | B47: - | C47: Прокладка | D47: 96 | E47: 1271.04 | F47: 166.56 | G47: 89.28 | H47: 924.48 | I47: 45.12 | J47: =SUM(RC[-5]:RC[-1]) -> 2496.4799999999996
A48: 18*55 | B48: - | C48: Прокладка | D48: 8000 | E48: 2240 | F48: 771.2 | G48: 160 | H48: 80 | I48: 160 | J48: =SUM(RC[-5]:RC[-1]) -> 3411.2
A49: 27*45*1,5 | B49: - | C49: Шайба | D49: 5000 | E49: 2100 | F49: 1041 | G49: 150 | H49: 300 | I49: 150 | J49: =SUM(RC[-5]:RC[-1]) -> 3741
A50: 18*45*1,5 | B50: - | C50: Шайба | D50: 1500 | E50: 840 | F50: 312.3 | G50: 60 | H50: 90 | I50: 45 | J50: =SUM(RC[-5]:RC[-1]) -> 1347.3
A51: Итого по наряду | D51: =SUM(R[-12]C:R[-1]C) -> 15886 | E51: =SUM(R[-12]C:R[-1]C) -> 8300.69 | F51: =SUM(R[-12]C:R[-1]C) -> 5613.5780000000004 | G51: =SUM(R[-12]C:R[-1]C) -> 589.23 | H51: =SUM(R[-12]C:R[-1]C) -> 7057.7800000000007 | I51: =SUM(R[-12]C:R[-1]C) -> 786.81999999999994 | J51: =SUM(RC[-5]:RC[-1]) -> 22348.097999999998
A53: Всего | D53: 18067 | E53: 23360.84 | F53: 10968.658999999998 | G53: 1646.3299999999997 | H53: 22209.38 | I53: 1614.64 | J53: =SUM(RC[-5]:RC[-1]) -> 59799.849000000002