Sheet: Лист1
L1: Унифицированная форма № ТОРГ-12 Утверждена
L2: постановлением Госкомстата России от 25.12.98 № 132
Q3: Код
O4: Форма по ОКУД | Q4: 330212
A5: ООО "Элма-1, 620076, г. Екатеринбург, пл. Жуковского, 1в, т. 295-98-29, ф. 295-98-56, ИНН 6664068381/666401001, р/с 40702810400000004026 | P5: по ОКПО | Q5: 51835367
A6: грузоотправитель, адрес, номер телефона, банковские реквизиты
A7: в ОАО "СКБ-Банк" г. Екатеринбург, к/с 30101810800000000756, БИК 046577756. | O7: Вид деятельности по ОКДП
A8: структурное подразделение
A9: Грузополучатель | C9: ООО "Энерго-Инопром", ИНН 6604028666/660401001, 623700, Свердловская обл., г. Березовский, ул. Коммуны, д. 31 | P9: по ОКПО
A10: р/с 40702810062450000211 в ОАО "УБРИР" г. Екатеринбург, к/с 30101810900000000795, БИК 046577795
A11: Поставщик | C11: =R[-6]C[-2] -> ООО "Элма-1, 620076, г. Екатеринбург, пл. Жуковского, 1в, т. 295-98-29, ф. 295-98-56, ИНН 6664068381/666401001, р/с 40702810400000004026 | P11: по ОКПО | Q11: 51835367
A12: в ОАО "СКБ-Банк" г. Екатеринбург, к/с 30101810800000000756, БИК 046577756.
A13: Плательщик | C13: =R[-4]C -> ООО "Энерго-Инопром", ИНН 6604028666/660401001, 623700, Свердловская обл., г. Березовский, ул. Коммуны, д. 31 | P13: по ОКПО
A14: =R[-4]C -> р/с 40702810062450000211 в ОАО "УБРИР" г. Екатеринбург, к/с 30101810900000000795, БИК 046577795
A15: Основание | C15: счет384 от 08,07,2013г. Наличный расчет | P15: номер
A16: договор, заказ-наряд | P16: дата
M17: Транспортная накладная | P17: номер
G18: Номер документа | I18: Дата составления | P18: дата
A19: ТОВАРНАЯ НАКЛАДНАЯ | G19: 416 | I19: 2013-07-24T00:00:00.000 | O19: Вид операции
A20: Номер по порядку | B20: Товар | F20: Единица измерения | H20: Вид упаковки | I20: Количество | K20: Масса, брутто | L20: Количество (масса, нетто) | M20: Цена, руб. коп. | N20: Сумма без учета НДС, руб. коп. | O20: НДС | Q20: Сумма с учетом НДС, руб. коп.
B21: Наименование, характеристика, сорт, артикул товара | E21: код | F21: наименование | G21: код по ОКЕИ | I21: в одном месте | J21: мест, штук | O21: ставка, % | P21: сумма, руб. коп.
A23: 1 | B23: 2 | E23: 3 | F23: 4 | G23: 5 | H23: 6 | I23: 7 | J23: 8 | K23: 9 | L23: 10 | M23: 11 | N23: 12 | O23: 13 | P23: 14 | Q23: 15
A24: 1 | B24: Рукав 5СЯ.462.024 | F24: ='\ТЗ 23.03\Отчетные документы\17-03-2016_14-53-25\[Накладная МХК Сысерть.xls]счф82'!R[1]C[-3] -> шт | G24: ='\ТЗ 23.03\Отчетные документы\17-03-2016_14-53-25\[Накладная МХК Сысерть.xls]счф293'!R[-3]C[-5] -> 796 | L24: 4 | M24: 1200 | N24: =RC[-2]*RC[-1] -> 4800 | O24: 0.18 | P24: =RC[-2]*0.18 -> 864 | Q24: =RC[-1]+RC[-3] -> 5664
A25: 2 | B25: Рукав 5СЯ.462.023 | F25: ='\ТЗ 23.03\Отчетные документы\17-03-2016_14-53-25\[Накладная МХК Сысерть.xls]счф82'!R[1]C[-3] -> шт | G25: ='\ТЗ 23.03\Отчетные документы\17-03-2016_14-53-25\[Накладная МХК Сысерть.xls]счф293'!R[-3]C[-5] -> 796 | L25: 4 | M25: 1200 | N25: =RC[-2]*RC[-1] -> 4800 | O25: 0.18 | P25: =RC[-2]*0.18 -> 864 | Q25: =RC[-1]+RC[-3] -> 5664
A26: 3 | B26: Прокладка 5СЯ.760.000 | F26: ='\ТЗ 23.03\Отчетные документы\17-03-2016_14-53-25\[Накладная МХК Сысерть.xls]счф82'!R[1]C[-3] -> шт | G26: 796 | L26: 33 | M26: 942.61 | N26: =RC[-2]*RC[-1] -> 31106.13 | O26: 0.18 | P26: =RC[-2]*0.18 -> 5599.1034 | Q26: =RC[-1]+RC[-3] -> 36705.233399999997
A27: 4 | B27: Клапан 5БП.456.210 | F27: ='\ТЗ 23.03\Отчетные документы\17-03-2016_14-53-25\[Накладная МХК Сысерть.xls]счф82'!R[1]C[-3] -> шт | G27: 796 | L27: 4 | M27: 950 | N27: =RC[-2]*RC[-1] -> 3800 | O27: 0.18 | P27: =RC[-2]*0.18 -> 684 | Q27: =RC[-1]+RC[-3] -> 4484
I28: Итого | N28: =SUM(R[-4]C:R[-1]C) -> 44506.130000000005 | P28: =RC[-2]*0.18 -> 8011.1034000000009 | Q28: =RC[-3]*1.18 -> 52517.233400000005
D29: Товарная накладная имеет приложение на___________________________листах
D30: и содержит | F30: 4 | I30: порядковых записей
A31: Приложение (паспорта, сертификаты) на | G31: листах | J31: По доверенности № _______________от "___"__________________2013г.
A32: Всего отпущено на сумму | D32: =R[-4]C[13] -> 52517.233400000005 | J32: выданной_____________________________________________________
A33: Отпуск груза разрешил_____________________Холодников Ю.В. | J33: Груз получил___________________________________________________
A34: Главный бухгалтер________________________Холодникова В.П. | J34: ______________________________________________________________
A35: Отпуск груза произвел________________________"____"___________2013г. | J35: "________"__________________________2013г.