Sheet: Лист1
A1: Учет материалов (по заявке) 15.06.2016 - 30.06.2016
A3: Артикул | B3: Группа | C3: Чертеж | D3: Наименование | E3: № заявки | F3: Кол-во | G3: Масса по чертежу 1 шт, кг | H3: Масса для закупа, кг
A5: Войлок-16
A6: 1 | B6: 8СЯ | C6: 230.450 | D6: Уплотнение | E6: 12 | F6: 10 | G6: 0.02 | H6: =RC[-1]*RC[-2] -> 0.2
A7: 2 | B7: 8БП | C7: 120.457 | D7: Шайба | E7: 15 | F7: 50 | G7: 0.01 | H7: =RC[-1]*RC[-2] -> 0.5
G8: Итого | H8: =SUM(R[-2]C:R[-1]C) -> 0.7
A10: Резина-1456
A11: 1 | B11: 9БП | C11: 110.580 | D11: Прокладка | E11: 27 | F11: 100 | G11: 5.0000000000000001E-3 | H11: =RC[-1]*RC[-2] -> 0.5
G12: Итого | H12: =SUM(R[-2]C:R[-1]C) -> 0.5